{
    "$schema": "http://json-schema.org/draft-04/schema#",
    "type": "object",
    "properties": {
      "title": {
        "type": "string"
      },
      "description": {
        "type": "string"
      },
      "type": {
        "type": "string"
      },
      "url": {
        "type": "string"
      },
      "ping_url": {
        "type": "string"
      },
      "attributions": {
        "type": "string"
      }
    },
    "required": [
      "description",
      "type",
      "url"
    ]
  }